"Entry","MaleText","FemaleText","LanguageId","EmoteId1","EmoteId2","EmoteId3","EmoteDelay1","EmoteDelay2","EmoteDelay3"
"5101","Ah, Braenna Flintcrag.  She has magic hands, that one.  Braenna is the one to see about Priestly matters.  ~~Ye'll want to travel north from the gates of Ironforge to the Hall of Mysteries.  That's where ye'll find her.","Ah, Braenna Flintcrag.  She has magic hands, that one.  Braenna is the one to see about Priestly matters.  ~~Ye'll want to travel north from the gates of Ironforge to the Hall of Mysteries.  That's where ye'll find her.","0","1","0","0","0","0","0"
"5103","Brandur Ironhammer would be the one ye'd want to see.  Ye can find him in the Hall of Mysteries north of the gates of Ironforge.","Brandur Ironhammer would be the one ye'd want to see.  Ye can find him in the Hall of Mysteries north of the gates of Ironforge.","0","1","0","0","0","0","0"
"5104","Ah, good ol' Brandur Ironhammer.  There's no doubt he'll provide ye with the guidance ye seek, $glad : lass;.  Ye'll find him in the Hall of Mysteries north of the gates of Ironforge.","Ah, good ol' Brandur Ironhammer.  There's no doubt he'll provide ye with the guidance ye seek, $glad : lass;.  Ye'll find him in the Hall of Mysteries north of the gates of Ironforge.","0","1","0","0","0","0","0"
"5106","Now why would ye be needing the services of one of those types?  We get enough trouble out of that rogue, Hulfdan Blackbeard, over in The Forlorn Cavern, do I need to be turning my eye to you as well?","Now why would ye be needing the services of one of those types?  We get enough trouble out of that rogue, Hulfdan Blackbeard, over in The Forlorn Cavern, do I need to be turning my eye to you as well?","0","1","0","0","0","0","0"
"5107","All the roguish types hang out in The Forlorn Cavern, north of the gates of Ironforge.  I'd wager ye'll find Fenthwick there, no doubt counting the coin of another cut purse.  I'll catch him one of these days!  ~~In the meantime I'll have my eye on you as well, $glad : lass;.","All the roguish types hang out in The Forlorn Cavern, north of the gates of Ironforge.  I'd wager ye'll find Fenthwick there, no doubt counting the coin of another cut purse.  I'll catch him one of these days!  ~~In the meantime I'll have my eye on you as well, $glad : lass;.","0","1","0","0","0","0","0"
"5109","Where better to look for a dark and brooding lot, than the dark section of Ironforge, aptly named The Forlorn Cavern.  Thistleheart is sure to be found there, likely summoning some manner of vile creature to do his bidding.","Where better to look for a dark and brooding lot, than the dark section of Ironforge, aptly named The Forlorn Cavern.  Thistleheart is sure to be found there, likely summoning some manner of vile creature to do his bidding.","0","1","0","0","0","0","0"
"5111","Och! Ye seek training in the way of the warrior, do ye?  Kelstrum Stonebreaker will put ye through yer paces!  Just march yerself over to the Hall of Arms east of the gates of Ironforge. ","Och! Ye seek training in the way of the warrior, do ye?  Kelstrum Stonebreaker will put ye through yer paces!  Just march yerself over to the Hall of Arms east of the gates of Ironforge. ","0","1","0","0","0","0","0"
"5113","Which profession trainer would ye be looking for?","Which profession trainer would ye be looking for?","0","0","0","0","0","0","0"
"5115","An Alchemy trainer is what you need?  Well, I just came from there, I did.  Ye'll find Ms. Berryfizz over in Tinker Town where the gnomes gather.","An Alchemy trainer is what you need?  Well, I just came from there, I did.  Ye'll find Ms. Berryfizz over in Tinker Town where the gnomes gather.","0","1","0","0","0","0","0"
"5116","Yer looking for an Alchemy trainer are ye?  Just came from there, I did.  Ye'll find Ms. Berryfizz over in Tinker Town where the gnomes gather.  ~~::sigh:: ...why o' why didn't I take the blue potion.","Yer looking for an Alchemy trainer are ye?  Just came from there, I did.  Ye'll find Ms. Berryfizz over in Tinker Town where the gnomes gather.  ~~::sigh:: ...why o' why didn't I take the blue potion.","0","1","0","0","0","0","0"
"5118","Ye've come to the right place $glad : lass;!  People come here from all o'er the world to train to be a blacksmith.  Ye'll find Bengus Deepforge hammering away at an anvil in the middle of our fine city by The Great Forge itself.","Ye've come to the right place $glad : lass;!  People come here from all o'er the world to train to be a blacksmith.  Ye'll find Bengus Deepforge hammering away at an anvil in the middle of our fine city by The Great Forge itself.","0","5","1","0","0","0","0"
"5120","A Cooking trainer is it?  Well then, get yerself over to the Bronze Kettle on the northeastern side of The Great Forge.  Daryl Riknussun will teach ye to make a mighty fine dish that's sure to put the life back in ye!","A Cooking trainer is it?  Well then, get yerself over to the Bronze Kettle on the northeastern side of The Great Forge.  Daryl Riknussun will teach ye to make a mighty fine dish that's sure to put the life back in ye!","0","1","0","0","0","0","0"
"5122","Ah, I believe Gimble Thistlefuzz is who ye'll be needing if yer looking to learn the Enchanter's profession.  Ye'll find Gimble in his shop, Thistlefuzz Arcanery, right by the Gryphon Master at The Great Forge.","Ah, I believe Gimble Thistlefuzz is who ye'll be needing if yer looking to learn the Enchanter's profession.  Ye'll find Gimble in his shop, Thistlefuzz Arcanery, right by the Gryphon Master at The Great Forge.","0","1","0","0","0","0","0"
"5124","The tinkerer's craft for you is it?  No doubt ye'll want to go see Springspindle Fizzlegear in Tinker Town.  ~~Just head east from the gates of Ironforge, or follow the sound of the explosions.","The tinkerer's craft for you is it?  No doubt ye'll want to go see Springspindle Fizzlegear in Tinker Town.  ~~Just head east from the gates of Ironforge, or follow the sound of the explosions.","0","1","0","0","0","0","0"
"5126","A valuable skill First Aid is.  Our resident trainer, Nissa Firestone, can show ye how it's done.  Look for her on the southern side of The Great Forge at the Ironforge Physician.","A valuable skill First Aid is.  Our resident trainer, Nissa Firestone, can show ye how it's done.  Look for her on the southern side of The Great Forge at the Ironforge Physician.","0","1","0","0","0","0","0"
"5128","Grimnur Stonebrand will tell ye some whoppers about the one that got away, but he's still one o' the best fishermen around.  He's got a shop set up in The Forlorn Cavern called the Traveling Fisherman.","Grimnur Stonebrand will tell ye some whoppers about the one that got away, but he's still one o' the best fishermen around.  He's got a shop set up in The Forlorn Cavern called the Traveling Fisherman.","0","1","0","0","0","0","0"
"5131","Flowers and seeds and such?  That would be Reyna Stonebranch's area of expertise.  Ye can find her tending to her plants over at the Ironforge Physician on the southern side of The Great Forge.","Flowers and seeds and such?  That would be Reyna Stonebranch's area of expertise.  Ye can find her tending to her plants over at the Ironforge Physician on the southern side of The Great Forge.","0","1","0","0","0","0","0"
"5132","Oh, ye want to learn to pick some daisies do ye?  Ha!  I'm just teasing ye $gladdie : lass;.  ~~A fine profession it is, and Reyna Stonebranch can show ye how it's done.  She works at the Ironforge Physician on the southern side of The Great Forge.","Oh, ye want to learn to pick some daisies do ye?  Ha!  I'm just teasing ye $gladdie : lass;.  ~~A fine profession it is, and Reyna Stonebranch can show ye how it's done.  She works at the Ironforge Physician on the southern side of The Great Forge.","0","1","0","0","0","0","0"
"5135","Fimble Finespindle has a shop set up on the northwest side of The Great Forge.  I wager he could show ye how to make some fine armor.","Fimble Finespindle has a shop set up on the northwest side of The Great Forge.  I wager he could show ye how to make some fine armor.","0","1","0","0","0","0","0"
"5139","Do we have Mining trainers here?  Where do ye think ye are!?  ~~Why you'll find one o' the best miners in all Dun Morogh at the Deepmountain Mining Guild on the northern side of The Great Forge.  There, Geofram Bouldertoe will show ye the true art of mining.","Do we have Mining trainers here?  Where do ye think ye are!?  ~~Why you'll find one o' the best miners in all Dun Morogh at the Deepmountain Mining Guild on the northern side of The Great Forge.  There, Geofram Bouldertoe will show ye the true art of mining.","0","5","1","0","0","0","0"
"5141","Balthus Stoneflayer is the one to see about Skinning.  If it can be skinned, he can teach ye how.  Just walk yerself over to Finespindle's Leather Goods on the northern side of The Great Forge.","Balthus Stoneflayer is the one to see about Skinning.  If it can be skinned, he can teach ye how.  Just walk yerself over to Finespindle's Leather Goods on the northern side of The Great Forge.","0","1","0","0","0","0","0"
"5145","That Jormund Stonebrow has a knack for the needle, he does.  Should you be needing some training, then you'll find him at Stonebrow's Clothier on the northern side of The Great Forge.","That Jormund Stonebrow has a knack for the needle, he does.  Should you be needing some training, then you'll find him at Stonebrow's Clothier on the northern side of The Great Forge.","0","1","0","0","0","0","0"
"5150","I have suffered, but now I can feel it slowly fading from me. I feel... free.","","0","0","0","0","0","0","0"
"5151","The Crystal Pylons of Un'Goro are a mystery to all. To the few inhabitants here, they are a source of legend, with much speculation as to their purpose.","","0","0","0","0","0","0","0"
"5153","A closer inspection of the pylon leads you to find a small table containing blue, yellow, and green crystals arranged in what seems like a specific formation.$B$BA large blue circle of crystals is flanked on either side by a smaller circle of yellow crystals and another of green crystals.$B$BYou carefully take note of the colors of the crystals, knowing that J.D. would be very interested in hearing about what you have found.","","0","0","0","0","0","0","0"
"5154","A closer inspection of the pylon leads you to find a small table containing yellow, red, and green crystals arranged in what seems like a specific formation.$B$BA large yellow circle of crystals is flanked on either side by a smaller circle of red crystals and another of green crystals.$B$BYou carefully take note of the colors of the crystals, knowing that J.D. would be very interested in hearing about what you have found.","","0","0","0","0","0","0","0"
"5155","A closer inspection of the pylon leads you to find a small table containing red, blue, and green crystals arranged in what seems like a specific formation.$B$BA large red circle of crystals is flanked on either side by a smaller circle of blue crystals and another of green crystals.$B$BYou carefully take note of the colors of the crystals, knowing that J.D. would be very interested in hearing about what you have found.","","0","0","0","0","0","0","0"
"5171","","You probably weren't expecting to find me in this cave, were you?$B$BMy name's J.D., and I really can't tell you much about how I got here, but what I can tell you is that this cave is my home now!$B$BI spend my time studying the strange crystals that can be found all over the crater.","0","0","0","0","0","0","0"
"5176","Burning Steppes - Tablet of the Seven","","6","0","0","0","0","0","0"
"5178","The symbols on the tablet are carefully transcribed...","","0","0","0","0","0","0","0"
"5179","Greetings, $c. For some, the hunter is a way of life, a chosen profession. For others, it is something of a pastime, a badge of courage, or a rite of passage depending on your tribe.$B$BFor me, race and profession mean nothing--it is the testing of your spirit and mind that I respect. For one to stand against the forces of nature and test all of their skills is the true mark of honor.$B$BIf you wish to test yourself and earn my respect, then speak to me more.","","0","0","0","0","0","0","0"
"5181","You've started down an honorable path, $n. My ancestors respect your willingness, but you will not have my approval until you have followed through with my tasks.$B$BYou know what you must do if you wish to prove yourself a hunter in spirit.","","0","0","0","0","0","0","0"
"5182","I give you warm greetin's, $c, as does the Shattered Hand.$B$BDo not look so surprised, $n. There be shadows even on the highest perches of Orgrimmar--somethin' must hide there. The Shattered Hand take that role willingly. Thrall, even in his good heart, acknowledge that the Hand be necessary to ensure orc and troll safety.$B$BBut you not here to talk 'bout my business, you here for somethin' else.","","0","0","0","0","0","0","0"
"5185","","Thanks to you, we can now unlock the secrets of the crystals and the mysterious pylons, $n. If you need more information at any time, please come back and visit me again!","0","0","0","0","0","0","0"
"5189","The ravasaur here in Un'Goro seem to be related to the raptors of the barrens--highly intelligent, volatile, and with a sense or code of conduct. The greatest of these that I have encountered is  Lar'korwi. He is one of the most dangerous beasts I've ever seen. In taurahe, Lar'korwi means ""sharp claw,"" but that does not do him justice.$B$BDo not underestimate Lar'korwi if you ever plan on hunting him, but I will help you in any way I can if you do.","","0","0","0","0","0","0","0"
"5192","","The Eastern Pylon accepts blue, yellow, and green crystals.$B$BIt focuses on the energy that can be created using blue crystals as the main source of power. There are two possible effects: one provides bonus to spirit, and one that creates a damaging shield.$B$BCrystal Force requires blue and green crystals. This will provide you with an increase in spirit.$B$BCrystal Spire requires blue and yellow crystals. This will create a shield that does damage to attackers.~~","0","0","0","0","0","0","0"
"5193","","The Northern Pylon accepts yellow, red, and green crystals.$B$BThe focus is the energy that can be created using yellow crystals as the main source of power. There are two possible effects: one that will produce damage, and one that will negate damage. $B$BCrystal Charge requires red and yellow crystals. This will produce a large explosion, stunning your enemies.$B$BCrystal Restore requires yellow and green crystals. This will provide you with a healing aura.","0","0","0","0","0","0","0"
"5194","","The Western Pylon accepts red, green, and blue crystals.$B$BThe Pylon focuses on the energy that can be created using red crystals as the main source of power. There are two possible effects: one that increases your protection from damage, and one that weakens an enemy's defenses.$B$BCrystal Ward requires red and green crystals. This will provide you with an increase to armor.$B$BCrystal Yield requires blue and red crystals. This can lower the armor of a specific target.","0","0","0","0","0","0","0"
"5195","","Sure thing, $n. Here's another for you.","0","0","0","0","0","0","0"
"5204","","These once beautiful woods suffer under a terrible curse!  Corrupting forces twist the life here into shadows of their former selves.  If you are not an agent of this corruption, then perhaps you can aid me in reclaiming Felwood!","0","5","0","0","0","0","0"
"5206","","""Taurahe?""$B$BThe tauren druid looks at you expectantly, but it is clear you cannot verbally communicate with her.  Undaunted, she points to herself and smiles.  She points at you and smiles once more.  She finally motions several times down the path to the south.$B$BPerhaps she is indicating that there is a druid you can speak to further down the road?~","0","6","274","0","0","0","0"
"5208","","These once beautiful woods suffer under a terrible curse!  Corrupting forces twist the life here into shadows of their former selves.  If you are not an agent of this corruption, then perhaps you can aid me in reclaiming Felwood!","0","5","0","0","0","0","0"
"5209","","""Darnassae?""$B$BThe night elf druid looks at you expectantly, but it is clear you cannot verbally communicate with her.  Undaunted, she points to herself and smiles.  She points at you and smiles once more.  She finally motions several times down the path to the north.$B$BPerhaps she is indicating that there is a druid you can speak to further up the road?","0","6","0","0","0","0","0"
"5211","HELP!!!!","","0","5","0","0","0","0","0"
"5219","Did Crest send you?","","0","0","0","0","0","0","0"
"5240","","There are plants in Felwood that may be saved from corruption when Cenarion plant salve is applied to them.  I know how to make the salve from several different kinds of items; based on your skill set, you may find that you have multiple options to assist me.$B$BYou will also need a Cenarion beacon for your work here; it is a device that allows you to see the taint and corruption of nature that the naked eye will miss.","0","1","0","0","0","0","0"
"5241","","There are plants in Felwood that may be saved from corruption when Cenarion plant salve is applied to them.  I know how to make the salve from several different kinds of items; based on your skill set, you may find that you have multiple options to assist me.$B$BYou will also need a Cenarion beacon for your work here; it is a device that allows you to see the taint and corruption of nature that the naked eye will miss.","0","1","0","0","0","0","0"
"5246","The remains are covered in flies and maggots.","","0","0","0","0","0","0","0"
"5254","The large shrine was built many years ago by the night elves that once inhabited this land.$B$BWhat secrets could it hold?","","0","0","0","0","0","0","0"
"5270","The secrets hidden within the Pylons of Un'Goro Crater are now yours. Visit the Pylons at any time to access their power and gain useful resources.","","0","0","0","0","0","0","0"
"5274","Welcome to Tanaris, $n. How can I be of service to you today? You don't look like a blacksmith to me, but I know how looks can be deceiving.","","0","0","0","0","0","0","0"
"5284","I do not enjoy conversation.","","0","0","0","0","0","0","0"
"5290","They are lost, $r. Librams written by the elven masters. Scattered across the world when the Scourge was unleashed upon Quel'Thalas.$B$BNow we search for these librams. Search to find the secrets they hold - to restore power once had.$B$BI search for the ten written by Master Kariel Winthalus. Should you find a libram, allow me to absorb its magical properties and for you I shall craft an amalgamation of power... of course, all things come at some cost. You will find my cost to be high; but pay you shall.","","0","1","1","25","0","0","0"
"5292","Ah, so... you have found it.$B$B<Mathredis points to the book in your possession.>$B$BHave you collected the necessary components?$B$BThe manifestations listed in the libram, imbecile!","","0","1","6","5","0","0","0"
"5293","<Mathredis gazes intently at the libram.>$B$BYou come for an amalgamation? Have you done as the libram instructed?","","0","6","1","6","0","0","0"
"5295","A rare find, indeed.$B$B<Mathredis nods.>$B$B If you wish to continue, I will need the components.","","0","1","1","0","0","0","0"
"5296","Greed has led you back to me.$B$B<Mathredis laughs.>$B$BA wise Draenei once told me that it - greed - is the single quality that all of the races on this world share. I would have to agree.$B$BHave you collected the components listed within the libram?","","0","153","1","6","0","0","0"
"5298","May the Light protect you this day.","May the Light protect you this day.","0","0","0","0","0","0","0"
"5304","What want from Raze??","","0","0","0","0","0","0","0"
"5317","Where is the Auction House?  Why it's right by the gates of Ironforge as you enter our fine city.  Ye'll find it just across from The Vault.","Where is the Auction House?  Why it's right by the gates of Ironforge as you enter our fine city.  Ye'll find it just across from The Vault.","0","0","0","0","0","0","0"
"5325","Of all the wondrous places within Darnassus, which would you have me direct you to?","Of all the wondrous places within Darnassus, which would you have me direct you to?","0","0","0","0","0","0","0"
"5329","You may find storage for your worldly goods at the bank of Darnassus, which lies in the center of our wondrous city.","You may find storage for your worldly goods at the bank of Darnassus, which lies in the center of our wondrous city.","0","0","0","0","0","0","0"
"5331","Vesprystus' hippogryphs will bear you swiftly to your destination.  Seek him out in Rut'theran Village, through the portal which lies in the western section of Darnassus.","Vesprystus' hippogryphs will bear you swiftly to your destination.  Seek him out in Rut'theran Village, through the portal which lies in the western section of Darnassus.","0","0","0","0","0","0","0"
"5333","If you desire to form a fellowship then it is the guild master, Lysheana, that you must see.  You will find her in the Craftsmen's Terrace in the northeastern section of Darnassus.","If you desire to form a fellowship then it is the guild master, Lysheana, that you must see.  You will find her in the Craftsmen's Terrace in the northeastern section of Darnassus.","0","0","0","0","0","0","0"
"5335","Though I find the cool grass which covers Teldrassil as good a bed as any, the beds which Saelienne keeps at the Inn in Craftsman's Terrace are quite suitable for those with a taste for luxury.","Though I find the cool grass which covers Teldrassil as good a bed as any, the beds which Saelienne keeps at the Inn in Craftsman's Terrace are quite suitable for those with a taste for luxury.","0","0","0","0","0","0","0"
"5339","Here in Darnassus you will find skilled trainers who have perfected the skills of their chosen class through ages of training and dedication.  I will guide you to one who can become your mentor, you have but to name your chosen path.","Here in Darnassus you will find skilled trainers who have perfected the skills of their chosen class through ages of training and dedication.  I will guide you to one who can become your mentor, you have but to name your chosen path.","0","0","0","0","0","0","0"
"5341","You are fortunate to have come to Darnassus where you can find such an accomplished Hunter as Jocaste among our trainers.  I encourage you to visit her over in the Cenarion Enclave and seek her tutelage.","You are fortunate to have come to Darnassus where you can find such an accomplished Hunter as Jocaste among our trainers.  I encourage you to visit her over in the Cenarion Enclave and seek her tutelage.","0","0","0","0","0","0","0"
"5343","In grizzly times a druid can be a dear friend to those around them.  Ask any of the druids in the Cenarion Enclave and they will tell you the same.","In grizzly times a druid can be a dear friend to those around them.  Ask any of the druids in the Cenarion Enclave and they will tell you the same.","0","0","0","0","0","0","0"
"5345","The Temple of the Moon is home to the priests of Elune.  There you will find Jandria and Lariia, who will provide you with further guidance in the path of priesthood.","The Temple of the Moon is home to the priests of Elune.  There you will find Jandria and Lariia, who will provide you with further guidance in the path of priesthood.","0","0","0","0","0","0","0"
"5346","The power of Elune compels you!  The power of Elune compels you!  ~~Go now!  Seek out Jandria in the central hall of the Temple of the Moon in the southern section of Darnassus!","The power of Elune compels you!  The power of Elune compels you!  ~~Go now!  Seek out Jandria in the central hall of the Temple of the Moon in the southern section of Darnassus!","0","0","0","0","0","0","0"
"5348","It is Syurna that you seek if you are to follow the rogue's path.  She dwells in the Cenarion Enclave down the spiraling path within the western most tree.","It is Syurna that you seek if you are to follow the rogue's path.  She dwells in the Cenarion Enclave down the spiraling path within the western most tree.","0","0","0","0","0","0","0"
"5349","There are those that attempt to follow the path of the Rogue, but only the night elves are truly embraced by the night.  If you seek to walk the shaded path then find Syurna in the Cenarion Enclave.","There are those that attempt to follow the path of the Rogue, but only the night elves are truly embraced by the night.  If you seek to walk the shaded path then find Syurna in the Cenarion Enclave.","0","0","0","0","0","0","0"
"5353","Here among the craftsmen of Darnassus, there is a millenium of knowledge for the benefit of your chosen craft.  Now tell me, which craft do you find the most intriguing?","Here among the craftsmen of Darnassus, there is a millenium of knowledge for the benefit of your chosen craft.  Now tell me, which craft do you find the most intriguing?","0","0","0","0","0","0","0"
"5355","If you truly have the desire to learn this profession, then I would point you in the direction of Ainethil, a skilled alchemist at the Craftsmen's Terrace in northern Darnassus.","If you truly have the desire to learn this profession, then I would point you in the direction of Ainethil, a skilled alchemist at the Craftsmen's Terrace in northern Darnassus.","0","0","0","0","0","0","0"
