"Entry","MaleText","FemaleText","LanguageId","EmoteId1","EmoteId2","EmoteId3","EmoteDelay1","EmoteDelay2","EmoteDelay3"
"8269","Welcome, my $g brother : sister;.  If you are here to train, then I would be delighted to train you.$B$BThere will be a time soon where the call of the Emerald Dream will take hold in you.  You will hibernate for many years and walk amongst the purest of forms.  It is there and then that your ultimate training will take place.","Welcome, my $g brother : sister;.  If you are here to train, then I would be delighted to train you.$B$BThere will be a time soon where the call of the Emerald Dream will take hold in you.  You will hibernate for many years and walk amongst the purest of forms.  It is there and then that your ultimate training will take place.","7","0","0","0","0","0","0"
"8275","What can I do for ya?","What can I do for ya?","0","0","0","0","0","0","0"
"8276","I got nothin' more to teach! Not for somebody who knows as much as you do, anyway! You Horde types need to talk to Nogg in Orgrimmar!","","0","0","0","0","0","0","0"
"8285","","I mean you no harm. I am scouting the quilboar and taking notes of their activities. My people have noticed something odd--an emanation or darkness--coming from this area. I've come to investigate, and what I've found is very disturbing.$B$BThere seems to be an undead diplomat who is powerful in the ways of the arcane. I don't believe he's one of the Forsaken... I think it's worse.","0","0","0","0","0","0","0"
"8289","You know enough to be dangerous, but you still look like you need training to me $n.","You know enough to be dangerous, but you still look like you need training to me $n.","1","0","0","0","0","0","0"
"8291","Your will is not strong enough to manipulate the forces we control $c.","Your will is not strong enough to manipulate the forces we control $c.","1","0","0","0","0","0","0"
"8293","$n, how may I further your training in the eyes of the Earth Mother?","$n, how may I further your training in the eyes of the Earth Mother?","1","0","0","0","0","0","0"
"8294","Many are the paths of the Earth Mother.  May your ancestors watch over you $c.","Many are the paths of the Earth Mother.  May your ancestors watch over you $c.","1","0","0","0","0","0","0"
"8296","It is wise that you humble yourself before me $N in your desire for more warlock knowledge.","It is wise that you humble yourself before me $N in your desire for more warlock knowledge.","1","0","0","0","0","0","0"
"8297","I have no time to waste on the likes of you $c.","I have no time to waste on the likes of you $c.","1","0","0","0","0","0","0"
"8299","I can tell just by the way you're standing that you're no warrior.  $B$BWhy don't you go do something safe, like read a book.","I can tell just by the way you're standing that you're no warrior.  $B$BWhy don't you go do something safe, like read a book.","7","0","0","0","0","0","0"
"8300","The darkness does not embrace you, $c.  Cease your prattle and remove yourself from my sight!  Be gone!","The darkness does not embrace you, $c.  Cease your prattle and remove yourself from my sight!  Be gone!","7","0","0","0","0","0","0"
"8302","Yer no warrior... Why ye wouldn't even last a day under my training regimen!  $B$BA $c who thinks $ghe's : she's; a warrior.  Ha!","Yer no warrior... Why ye wouldn't even last a day under my training regimen!  $B$BA $c who thinks $ghe's : she's; a warrior.  Ha!","7","0","0","0","0","0","0"
"8303","I do not see the warrior's spirit within you, child.  I have no teachings which would benefit a $c such as yourself.","I do not see the warrior's spirit within you, child.  I have no teachings which would benefit a $c such as yourself.","7","0","0","0","0","0","0"
"8309","The Shattered Hand has been able to place spies throughout the upper citadel of Blackrock. Though the information gathering process has been slow, we have made discoveries that cannot be ignored.","","0","1","1","1","0","0","0"
"8311","It would appear as if the influence of the Black Dragonflight had extended beyond the borders of the Burning Steppes and into the kingdom of Stormwind itself! The usurper has since been unmasked and ousted.","","0","1","5","1","0","0","0"
"8313","Indeed. The brood mother of the Black Dragonflight had used illusion and trickery to disguise herself as a member of the royal court. Worse yet, she had assumed control of the current Highlord of Stormwind, Bolvar Fordragon.$B$BIt is no wonder that such foolish military decisions had been made. The movement of the Alliance forces as of late had left us scratching our heads. We now understand that the Black Flight was attempting to divide the empire - destroy it from within.","","0","1","1","1","0","0","0"
"8315","<Thrall laughs.>$B$BSo much to learn still, $r.$B$BYou are too young to remember the wars and bloodshed of ages past. Too young to remember the burden of the curse carried by our people.$B$BOur position with the Alliance right now is a tenuous one. Skirmishes and smaller battles do take place, but there is peace - something our people have not known for millennia. Would you give this up and plunge us into the maw of chaos again but against a new foe? One that will not rest until we are all destroyed?","","0","1","6","6","0","0","0"
"8317","No, $n, you did not. I do not fault you, however, as yours is a mind much like mine was as a youth: Impetuous, rebellious, and often without a single coherent thought! Traits I can no longer afford to express.$B$BEnough lamenting. $R, I have a task for you; one that you may not survive. ","","0","1","5","1","0","0","0"
"8319","<Thrall laughs.>$B$BNoted... Now pay attention, $n. The Black Dragonflight brood mother, Onyxia, has been flushed out from her position of power in Stormwind. She has escaped, fleeing to her lair in Dustwallow Marsh.$B$BShe cannot be allowed to live in such close proximity to our capital cities. We must strike before being struck!$B$BI want her destroyed, $n. ","","0","11","1","5","0","0","0"
"8322","Welcome, my $g brother : sister;.  If you are here to train, then I would be delighted to train you.$B$BWe are the preservers of the balance, now and forever, as Malfurion lies in the Dreaming.  Never forget this.","","0","2","0","0","0","0","0"
"8323","Welcome, my $g brother : sister;.  If you are here to train, then I would be delighted to train you.$B$BWe are the preservers of the balance, now and forever, as Malfurion lies in the Dreaming.  Never forget this.","","0","2","0","0","0","0","0"
"8325","I see some interesting characters come and go here at the port. Watch yourself, $n. It's never clear who to trust, what with all of the shady activity that goes on here...","","0","0","0","0","0","0","0"
"8326","So you're here for the Warsong axes. Well, it's about time, $n. That crate has been sitting out there for days, now.$B$BFeel free to haul it away whenever you are ready.","","0","1","25","0","0","0","0"
"8330","Stonetalon Mountain has many perilous caves through out this region.  Exploring these caves can hold many adventures for those willing to risk life for glory.$B$B$C, perhaps you seek riches that only following your heart and soul can garnish.","","0","0","0","0","0","0","0"
"8334","Fish so delicious. You come learn fish? Eat fish? Mmmmm...","","0","1","0","0","0","0","0"
"8336","Yap, I can teach ye to fish.","","0","1","0","0","0","0","0"
"8339","","Please, leave this place, $n. You know nothing of what troubles us...","0","0","0","0","0","0","0"
"8344","We may have been suffering a drought but there's no shortage of meat! Care to browse my goods?","","0","1","6","0","0","0","0"
"8346","","Can Zamja help you, $r?","0","6","0","0","0","0","0"
"8348","I keep 'em fed, kid. Yep, Daryl Riknussun, at yer service.","","0","1","0","0","0","0","0"
"8364","I am an orc of medicine, $r. If you have come here to learn, I shall do my best to teach.","","0","1","2","0","0","0","0"
"8368","","Are you a student of the medical sciences?","0","6","0","0","0","0","0"
"8370","","Why have you come here, $c?","0","0","0","0","0","0","0"
"8371","","My people, they are as shattered as the relic you seek to repair.","0","0","0","0","0","0","0"
"8389","Greetings, $c. Is there something I can help you with?","","0","0","0","0","0","0","0"
"8390","My question to you is this, $c:$BWhich of the Aspects created by the titans became the nefarious creature known as Deathwing?","","0","0","0","0","0","0","0"
"8391","It's always nice when someone wishes to speak to me. How are things with you, $c?","","0","0","0","0","0","0","0"
"8392","Now, answer me this, $n:$BWhich creature became the Lich King before spreading the plague across Lordaeron?","","0","0","0","0","0","0","0"
"8399","Yeah, you know a few things! If you wanna' learn more you're gonna' have to talk to Georgio Bolero in Stormwind.","","0","0","0","0","0","0","0"
"8400","The Thorium Brotherhood possesses the knowledge required to make the sacred arms and armaments of the Fire Lord, but we lack the manpower to obtain the materials required for the crafting.$B$BI, Lokhtos Darkbargainer, have been empowered by the Brotherhood to exchange the exalted recipes for materials gathered from the Molten Core.$B$BPresent your offer, $r.","","0","1","1","25","0","0","0"
"8402","Want to make your demons more powerful?  It'll cost you, but you've come to the right place.","Want to make your demons more powerful?  It'll cost you, but you've come to the right place.","0","0","0","0","0","0","0"
"8403","You're no warlock and I've no time for you.  Begone!","You're no warlock and I've no time for you.  Begone!","0","0","0","0","0","0","0"
"8406","You've come for training in order to pass it on to your pets?","You've come for training in order to pass it on to your pets?","0","0","0","0","0","0","0"
"8407","Ah friend, I only help hunters and their pets.","Ah friend, I only help hunters and their pets.","0","0","0","0","0","0","0"
"8411","The Royal Apothecary Society has little patience for fools, as do I.  Perhaps the next time you and I speak of my steeds, you will be considered exalted by the Undercity.  Until then...","The Royal Apothecary Society has little patience for fools, as do I.  Perhaps the next time you and I speak of my steeds, you will be considered exalted by the Undercity.  Until then...","0","1","0","0","0","0","0"
"8414","I only make my mounts available to those who are considered exalted to Orgrimmar and the Orcish race.  Go prove yourself to us, and I'll make my mighty wolves available for your inspection.","I only make my mounts available to those who are considered exalted to Orgrimmar and the Orcish race.  Go prove yourself to us, and I'll make my mighty wolves available for your inspection.","0","25","0","0","0","0","0"
"8415","I'm sorry $g mon : sis;, but I won't be sellin' my raptors to someone who hasn't proven themselves to be exalted to the Darkspear tribe.  When ya make a stand and show yourself to be no less than exalted to us, then I'll make my raptors available to ya.","I'm sorry $g mon : sis;, but I won't be sellin' my raptors to someone who hasn't proven themselves to be exalted to the Darkspear tribe.  When ya make a stand and show yourself to be no less than exalted to us, then I'll make my raptors available to ya.","0","25","0","0","0","0","0"
"8416","You are not known to my people.  A kodo is a mighty steed, and it is the product of love and care by my people; such is not given onto strangers.  Until the elders of Thunder Bluff consider you to be exalted, I cannot offer you the sale of a kodo.","You are not known to my people.  A kodo is a mighty steed, and it is the product of love and care by my people; such is not given onto strangers.  Until the elders of Thunder Bluff consider you to be exalted, I cannot offer you the sale of a kodo.","0","1","0","0","0","0","0"
"8417","Alas $c, you are not considered to be exalted to Darnassus and the night elves of Teldrassil.  Only when you prove yourself to us through deeds - not just mere words - will I then make available my selection of mounts for your perusal.","Alas $c, you are not considered to be exalted to Darnassus and the night elves of Teldrassil.  Only when you prove yourself to us through deeds - not just mere words - will I then make available my selection of mounts for your perusal.","0","1","0","0","0","0","0"
"8426","Plucky?  I heard race master Kronkrider up on the the tower knows where he is.","Plucky?  I heard race master Kronkrider up on the the tower knows where he is.","0","0","0","0","0","0","0"
"8427","You looking for plucky?  Well, you didn't hear me say this, but... maybe if you ask Kronkrider up in the tower, he'll tell you...","You looking for plucky?  Well, you didn't hear me say this, but... maybe if you ask Kronkrider up in the tower, he'll tell you...","0","0","0","0","0","0","0"
"8428","Sorry, but I am not disposed to sell horses to any individual who is not considered to be at least exalted to the Kingdom of Stormwind.  These steeds are the finest you'll find anywhere, and we certainly wouldn't want them in the hands of our enemies.$B$BNot saying you're an enemy, of course... just earn the trust of Stormwind and then we can do business.","Sorry, but I am not disposed to sell horses to any individual who is not considered to be at least exalted to the Kingdom of Stormwind.  These steeds are the finest you'll find anywhere, and we certainly wouldn't want them in the hands of our enemies.$B$BNot saying you're an enemy, of course... just earn the trust of Stormwind and then we can do business.","0","1","0","0","0","0","0"
"8429","Not so fast, $g guy : lady;... I'll not be handing out the reigns of a mighty ram steed to someone that's not a proven ally of the dwarves of Ironforge.  Once you've been recognized as exalted to Ironforge, I'll gladly show you what varieties of rams I have for sale.","Not so fast, $g guy : lady;... I'll not be handing out the reigns of a mighty ram steed to someone that's not a proven ally of the dwarves of Ironforge.  Once you've been recognized as exalted to Ironforge, I'll gladly show you what varieties of rams I have for sale.","0","25","0","0","0","0","0"
"8430","Erm... I really don't know you that well, sorry.  I mean, as an authorized Mechano-strider dealer, I really only can sell my mounts to those people who are considered exalted amongst the gnomes.  If you ever are recognized as exalted to Gnomeregan, I'd be happy to show you what I have to offer.","Erm... I really don't know you that well, sorry.  I mean, as an authorized Mechano-strider dealer, I really only can sell my mounts to those people who are considered exalted amongst the gnomes.  If you ever are recognized as exalted to Gnomeregan, I'd be happy to show you what I have to offer.","0","24","1","0","0","0","0"
"8431","You need to be exalted with the dwarves of Ironforge before I will teach you a riding skill, $c.","You need to be exalted with the dwarves of Ironforge before I will teach you a riding skill, $c.","0","1","0","0","0","0","0"
"8432","You need to be exalted with the Forsaken of the Undercity before I will teach you a riding skill, $c.","You need to be exalted with the Forsaken of the Undercity before I will teach you a riding skill, $c.","0","1","0","0","0","0","0"
"8433","You need to be exalted with the gnomes of the Gnomeregan Exiles before I will teach you how to pilot a Mechanostrider, $c.","You need to be exalted with the gnomes of the Gnomeregan Exiles before I will teach you how to pilot a Mechanostrider, $c.","0","1","0","0","0","0","0"
"8434","You need to be exalted with the humans of Stormwind before I will teach you a riding skill, $c.","You need to be exalted with the humans of Stormwind before I will teach you a riding skill, $c.","0","1","0","0","0","0","0"
"8435","You need to be exalted with the night elves of Darnassus before I will teach you a riding skill, $c.","You need to be exalted with the night elves of Darnassus before I will teach you a riding skill, $c.","0","1","0","0","0","0","0"
"8436","You need to be exalted with the orcs of Orgrimmar before I will teach you a riding skill, $c.","You need to be exalted with the orcs of Orgrimmar before I will teach you a riding skill, $c.","0","1","0","0","0","0","0"
"8437","You need to be exalted with the tauren of Thunder Bluff before I will teach you a riding skill, $c.","You need to be exalted with the tauren of Thunder Bluff before I will teach you a riding skill, $c.","0","1","0","0","0","0","0"
"8438","You need to be exalted with the trolls of the Darkspear tribe before I will teach you a riding skill, $c.","You need to be exalted with the trolls of the Darkspear tribe before I will teach you a riding skill, $c.","0","1","0","0","0","0","0"
"8440","","I do not believe you possess the mental acuity to grasp the nature of portal magic.","7","0","0","0","0","0","0"
"8441","","As a mage, you are one of a select group that can conjure a portal to transport you back to this very place.  I can teach you if you are ready.","7","0","0","0","0","0","0"
"8443","","I do not believe you possess the mental acuity to grasp the nature of portal magic.","7","0","0","0","0","0","0"
"8444","","As a mage, you are one of a select group that can conjure a portal to transport you back to this very place.  I can teach you if you are ready.","7","0","0","0","0","0","0"
"8445","I do not believe you possess the mental acuity to grasp the nature of portal magic.","","7","0","0","0","0","0","0"
"8446","As a mage, you are one of a select group that can conjure a portal to transport you back to this very place.  I can teach you if you are ready.","","7","0","0","0","0","0","0"
"8447","I do not believe you possess the mental acuity to grasp the nature of portal magic.","I do not believe you possess the mental acuity to grasp the nature of portal magic.","7","0","0","0","0","0","0"
"8448","As a mage, you are one of a select group that can conjure a portal to transport you back to this very place.  I can teach you if you are ready.","As a mage, you are one of a select group that can conjure a portal to transport you back to this very place.  I can teach you if you are ready.","7","0","0","0","0","0","0"
"8449","","I do not believe you possess the mental acuity to grasp the nature of portal magic.","1","0","0","0","0","0","0"
"8453","","As a mage, you are one of a select group that can conjure a portal to transport you back to this very place.  I can teach you if you are ready.","1","0","0","0","0","0","0"
"8454","I do not believe you possess the mental acuity to grasp the nature of portal magic.","","1","0","0","0","0","0","0"
"8455","As a mage, you are one of a select group that can conjure a portal to transport you back to this very place.  I can teach you if you are ready.","","1","0","0","0","0","0","0"
"8456","I do not believe you possess the mental acuity to grasp the nature of portal magic.","","1","0","0","0","0","0","0"
"8457","As a mage, you are one of a select group that can conjure a portal to transport you back to this very place.  I can teach you if you are ready.","","1","0","0","0","0","0","0"
"8463","Monty be me name an' rats be me game.","","0","1","0","0","0","0","0"
"8467","The strongest hides come from those kodo that have laid themselves to rest in this wasteland.","","0","0","0","0","0","0","0"
"8473","","Between the light and the dark, there is shadow... and those shadows have powers you have yet to see.","0","0","0","0","0","0","0"
"8474","","Between the light and the dark, there is shadow... and those shadows have powers you have yet to see.","0","0","0","0","0","0","0"
"8475","You'll find no finer rat kabob this side of Khaz Modan!","","0","1","5","0","0","0","0"
"8477","You look like you could use some work, $g fella:lady;. You should board the tram and visit my brother, Monty, at the Ironforge Deeprun Tram depot. I'm sure he has something you could do.","","0","1","1","0","0","0","0"
"8478","Watch your back, stranger.","","0","25","0","0","0","0","0"
"8479","Ravenholdt Manor does not recognize you, $c.","","0","1","0","0","0","0","0"
"8480","Brash. Master Ravenholdt does not like brash.","","0","1","0","0","0","0","0"
"8481","It is good to see you again, $n.","","0","1","0","0","0","0","0"
"8482","Greetings, $c. Have you spoken with Fahrad yet?","","0","6","0","0","0","0","0"
"8483","The Syndicate is made up of a bunch of hacks - disorganized, unskilled, and lazy... ","","0","1","0","0","0","0","0"
"8493","You dare set foot inside Ravenholdt Manor, worm?","You dare set foot inside Ravenholdt Manor, worm?","0","14","0","0","1","0","0"
"8494","Making it out of here without a blade in your back or poison in your veins would be an accomplishment.","Making it out of here without a blade in your back or poison in your veins would be an accomplishment.","0","1","0","0","0","0","0"
"8495","You're shaping up nicely, $n. I've heard good things...","You're shaping up nicely, $n. I've heard good things...","0","1","0","0","0","0","0"
"8496","You should talk to Winstone. I hear he's looking for thieves with your skill.","You should talk to Winstone. I hear he's looking for thieves with your skill.","0","1","0","0","0","0","0"
"8503","","May Elune walk with you, $c.  The Temple of the Moon has come to help the troubled citizens of Auberdine.","0","2","1","0","0","0","0"
"8509","Go to the Valley of Honor and seek out Xon'cha near the stables.","Go to the Valley of Honor and seek out Xon'cha near the stables.","1","0","0","0","0","0","0"
"8510","Xon'cha will stable your extra pets.  Find him in the Valley of Honor at the stables between the arena and the Hunter's Hall.  Now begone!","Xon'cha will stable your extra pets.  Find him in the Valley of Honor at the stables between the arena and the Hunter's Hall.  Now begone!","1","0","0","0","0","0","0"
"8516","It is the assistance of Bulrug that you need.  You will find him outside on the lower rise standing between the inn and the Thunder Bluff Bank.","It is the assistance of Bulrug that you need.  You will find him outside on the lower rise standing between the inn and the Thunder Bluff Bank.","1","0","0","0","0","0","0"
"8517","The concern that you show for the welfare of your animal companions is commendable.  Bulrug, on the lower rise, can help you with that.  Seek him out between the bank and the inn.","The concern that you show for the welfare of your animal companions is commendable.  Bulrug, on the lower rise, can help you with that.  Seek him out between the bank and the inn.","1","0","0","0","0","0","0"
"8519","Morganus the stable master can be found out in front of the stables strangely enough.","Morganus the stable master can be found out in front of the stables strangely enough.","1","0","0","0","0","0","0"
"8520","Not too clever are you?  Hmm, if I were a stable master perhaps I might be in the vicinity of say, the stable?  Look for Morganus over there.","Not too clever are you?  Hmm, if I were a stable master perhaps I might be in the vicinity of say, the stable?  Look for Morganus over there.","1","0","0","0","0","0","0"
"8522","Anya Maulray at inn on upper ring of Trade Quarter.","Anya Maulray at inn on upper ring of Trade Quarter.","1","0","0","0","0","0","0"
"8523","Us want lots of pets.  Anya Maulray help you take care of them.  You find her at inn, upper ring of Trade Quarter.","Us want lots of pets.  Anya Maulray help you take care of them.  You find her at inn, upper ring of Trade Quarter.","1","0","0","0","0","0","0"
"8526","You can trust any pets you have to be well taken care of by Alassin.  He resides in the Cenarion Enclave where the hunters gather.","You can trust any pets you have to be well taken care of by Alassin.  He resides in the Cenarion Enclave where the hunters gather.","7","0","0","0","0","0","0"
"8527","For many hundreds of years Alassin has cared for the animals that our hunters befriend.  His care of animals is highly sought for by the hunters around here.  If you seek him as well, then look for him in the Cenarion Enclave.","For many hundreds of years Alassin has cared for the animals that our hunters befriend.  His care of animals is highly sought for by the hunters around here.  If you seek him as well, then look for him in the Cenarion Enclave.","7","0","0","0","0","0","0"
"8528","We are all pieces of a much larger puzzle, $n. Just as you guide the piece of a puzzle to its destination, so too are we guided by another.$B$BAnd perhaps they who guide us are themselves guided by an even greater force.","","0","1","1","0","0","0","0"
"8532","Good ol' Erma, she's been taking care of the local animals for years now.  I'm sure she'd be happy to take care of any you'd like to put up.  She can be found right outside of the Lion's Pride Inn.","Good ol' Erma, she's been taking care of the local animals for years now.  I'm sure she'd be happy to take care of any you'd like to put up.  She can be found right outside of the Lion's Pride Inn.","7","0","0","0","0","0","0"
"8533","Erma does all the caring for animals around here.  She's right outside the Lion's Pride Inn if you need to speak with her.","Erma does all the caring for animals around here.  She's right outside the Lion's Pride Inn if you need to speak with her.","7","0","0","0","0","0","0"
"8537","Jenova Stoneshield over in the Dwarven District is the one you're looking for.  She tends to hunters' pets while they seek training from her father.","Jenova Stoneshield over in the Dwarven District is the one you're looking for.  She tends to hunters' pets while they seek training from her father.","7","0","0","0","0","0","0"
