"Entry","MaleText","FemaleText","LanguageId","EmoteId1","EmoteId2","EmoteId3","EmoteDelay1","EmoteDelay2","EmoteDelay3"
"6735","You'll find the Mage Trainer, Cain Firesong, upstairs on the landing at the Gallows' End Tavern, which is on the southeast end of Brill.  I guess he checked in too late to get a room.","You'll find the Mage Trainer, Cain Firesong, upstairs on the landing at the Gallows' End Tavern, which is on the southeast end of Brill.  I guess he checked in too late to get a room.","1","0","0","0","0","0","0"
"6736","Do I look to you like I cast spells?  Well, I did hear that Cain Firesong was hanging out on the upstairs landing of the Gallows' End Tavern at the southeast end of town.  Odd how he just stands there outside of Gretchen's room like that.","Do I look to you like I cast spells?  Well, I did hear that Cain Firesong was hanging out on the upstairs landing of the Gallows' End Tavern at the southeast end of town.  Odd how he just stands there outside of Gretchen's room like that.","1","0","0","0","0","0","0"
"6739","The Rogue Trainer's name is Marion Call.  You can find her upstairs in the reading room at the Gallows' End Tavern at the town's southeast edge.","The Rogue Trainer's name is Marion Call.  You can find her upstairs in the reading room at the Gallows' End Tavern at the town's southeast edge.","1","0","0","0","0","0","0"
"6740","Marion Call is keeping Dark Cleric Beryl company in the reading room upstairs at the Gallows' End Tavern on the southeast edge of Brill.  I'm just dying to see who wins that staring contest.","Marion Call is keeping Dark Cleric Beryl company in the reading room upstairs at the Gallows' End Tavern on the southeast edge of Brill.  I'm just dying to see who wins that staring contest.","1","0","0","0","0","0","0"
"6741","Rupert Boch is his name.  I hear that he's upstairs in one of the rooms at the Gallows' End Tavern on the southeast end of town.","Rupert Boch is his name.  I hear that he's upstairs in one of the rooms at the Gallows' End Tavern on the southeast end of town.","1","0","0","0","0","0","0"
"6742","That's Rupert Boch you're looking for.  He and his entourage have a room upstairs at the Gallows' End Tavern on the southeast end of Brill.","That's Rupert Boch you're looking for.  He and his entourage have a room upstairs at the Gallows' End Tavern on the southeast end of Brill.","1","0","0","0","0","0","0"
"6749","Fancy yourself a chef?  Head to the Undercity south of town for your training.  You can catch the elevators heading down at the back of the Ruins of Lordaeron.  Talk to one of those lumbering Undercity Guardians for further assistance once you arrive.","Fancy yourself a chef?  Head to the Undercity south of town for your training.  You can catch the elevators heading down at the back of the Ruins of Lordaeron.  Talk to one of those lumbering Undercity Guardians for further assistance once you arrive.","1","0","0","0","0","0","0"
"6750","Why cook when everything tastes like ashes in your mouth?  If you have one still that is.  Very well, head to the Undercity south of Brill and ask an Undercity Guardian there for further directions to their Cooking Trainer.  To get there you can take the elevators down from the rear of the Ruins of Lordaeron.","Why cook when everything tastes like ashes in your mouth?  If you have one still that is.  Very well, head to the Undercity south of Brill and ask an Undercity Guardian there for further directions to their Cooking Trainer.  To get there you can take the elevators down from the rear of the Ruins of Lordaeron.","1","0","0","0","0","0","0"
"6751","You can find Vance Undergloom upstairs in a room at the Gallows' End Tavern on the southeast side of Brill.","You can find Vance Undergloom upstairs in a room at the Gallows' End Tavern on the southeast side of Brill.","1","0","0","0","0","0","0"
"6752","Word is that Vance Undergloom has taken a permanent room upstairs at the Gallows' End Tavern at the southeast end of town.  I think he's just off the reading room.","Word is that Vance Undergloom has taken a permanent room upstairs at the Gallows' End Tavern at the southeast end of town.  I think he's just off the reading room.","1","0","0","0","0","0","0"
"6753","While there's no Engineering Trainer in Brill, there is one down in the Undercity.  To get there head to the back of the Ruins of Lordaeron to the south of town and take the elevator down.  Once you get there ask an Undercity Guardian for more specific directions.","While there's no Engineering Trainer in Brill, there is one down in the Undercity.  To get there head to the back of the Ruins of Lordaeron to the south of town and take the elevator down.  Once you get there ask an Undercity Guardian for more specific directions.","1","0","0","0","0","0","0"
"6754","Rifles, dynamite, bombs, exploding sheep... what's not to love?  To learn how to make these and many other exciting tools of the trade head to the Undercity, under the Ruins of Lordaeron to the south of Brill.  Take the elevators down at the back of the ruins.  Once you arrive speak to one of the Undercity Guardians about where the trainer is exactly.","Rifles, dynamite, bombs, exploding sheep... what's not to love?  To learn how to make these and many other exciting tools of the trade head to the Undercity, under the Ruins of Lordaeron to the south of Brill.  Take the elevators down at the back of the ruins.  Once you arrive speak to one of the Undercity Guardians about where the trainer is exactly.","1","0","0","0","0","0","0"
"6755","Nurse Neela greets all of her future customers as they enter the Gallows' End Tavern at the southeast end of town.","Nurse Neela greets all of her future customers as they enter the Gallows' End Tavern at the southeast end of town.","1","0","0","0","0","0","0"
"6756","Butcher you say?  Oh, First Aid Trainer!  Same thing.  When you see Nurse Neela standing just inside the Gallows' End Tavern on the southeast side of town you'll know why.","Butcher you say?  Oh, First Aid Trainer!  Same thing.  When you see Nurse Neela standing just inside the Gallows' End Tavern on the southeast side of town you'll know why.","1","0","0","0","0","0","0"
"6759","Look for Faruza.  Last I saw she was standing out front between the stables and the house on the northwest end of town.","Look for Faruza.  Last I saw she was standing out front between the stables and the house on the northwest end of town.","1","0","0","0","0","0","0"
"6760","Actually I prefer traditional medicines... leeches, maggots, bonesaws... that sort of thing.  Well to each their own.  You can find the our local Herbalism Trainer, Faruza, standing out front near the stables in Brill.","Actually I prefer traditional medicines... leeches, maggots, bonesaws... that sort of thing.  Well to each their own.  You can find the our local Herbalism Trainer, Faruza, standing out front near the stables in Brill.","1","0","0","0","0","0","0"
"6761","That would be Shelene Rhobart.  Take the road southeast out of Brill then head east at the intersection.  She's at a camp along the side of the road.","That would be Shelene Rhobart.  Take the road southeast out of Brill then head east at the intersection.  She's at a camp along the side of the road.","1","0","0","0","0","0","0"
"6762","Nothing quite like the feel of something dead rubbing up against you.  You can find Shelene Rhobart by heading southeast on the road out of town, and then going east at the intersection.  She's at a small camp there not too far along the road.","Nothing quite like the feel of something dead rubbing up against you.  You can find Shelene Rhobart by heading southeast on the road out of town, and then going east at the intersection.  She's at a small camp there not too far along the road.","1","0","0","0","0","0","0"
"6763","I hear that they have a Mining Trainer in the Undercity.  All you have to do to get there is head south out of town and go to the back of the Ruins of Lordaeron.  Then take the elevator down into the Undercity itself and ask an Undercity Guardian for further directions.","I hear that they have a Mining Trainer in the Undercity.  All you have to do to get there is head south out of town and go to the back of the Ruins of Lordaeron.  Then take the elevator down into the Undercity itself and ask an Undercity Guardian for further directions.","1","0","0","0","0","0","0"
"6764","I guess your first exercise is going to be to mine your way down to the Undercity.  Heh, get it?  Mine... nevermind.  To get to the Undercity go to the rear of the Ruins of Lordaeron south of Brill, and take the elevator down.  Ask one of the Undercity Guardians there for further assistance.","I guess your first exercise is going to be to mine your way down to the Undercity.  Heh, get it?  Mine... nevermind.  To get to the Undercity go to the rear of the Ruins of Lordaeron south of Brill, and take the elevator down.  Ask one of the Undercity Guardians there for further assistance.","1","0","0","0","0","0","0"
"6765","Rand Rhobart is fairly good at skinning felbats and the like.  You can find him at a camp along the road to the southeast of Brill.  Take the road southeast out of town and then head east at the intersection.","Rand Rhobart is fairly good at skinning felbats and the like.  You can find him at a camp along the road to the southeast of Brill.  Take the road southeast out of town and then head east at the intersection.","1","0","0","0","0","0","0"
"6766","You aiming to be a taxidermist?  I don't like people who think they can stuff and mount me because they think I'm dead.  No?  Good!  Look for Rand Rhobart at a camp to the southeast of town.  To get to him take the road southeast out of Brill and hang a left at the intersection.","You aiming to be a taxidermist?  I don't like people who think they can stuff and mount me because they think I'm dead.  No?  Good!  Look for Rand Rhobart at a camp to the southeast of town.  To get to him take the road southeast out of Brill and hang a left at the intersection.","1","0","0","0","0","0","0"
"6767","It is Bowen Brisboise that you seek then.  You'll find him inside his house southwest of Brill just on the other side of the bridge at Cold Hearth Manor.","It is Bowen Brisboise that you seek then.  You'll find him inside his house southwest of Brill just on the other side of the bridge at Cold Hearth Manor.","1","0","0","0","0","0","0"
"6768","Black, grey and dark purple are the prescribed colors.  See to it that you don't stray onto the wrong side of fashion street friend.  Bowen Brisboise can help to see that you don't.  You'll find him inside Cold Hearth Manor on the other side of the bridge to the southwest of town.","Black, grey and dark purple are the prescribed colors.  See to it that you don't stray onto the wrong side of fashion street friend.  Bowen Brisboise can help to see that you don't.  You'll find him inside Cold Hearth Manor on the other side of the bridge to the southwest of town.","1","0","0","0","0","0","0"
"6769","Which trainer do you seek?","Which trainer do you seek?","1","0","0","0","0","0","0"
"6775","Which profession?","Which profession?","1","0","0","0","0","0","0"
"6788","What are you looking for?","What are you looking for?","1","0","0","0","0","0","0"
"6800","","So cold... and hungry.$B$BMy poor friend, I hope you've found peace. I can't stand to think about what they could have done to you.$B$BYou! You there! Please, you have to help me escape. One of them has a key, can you find it? I know they have it. If you get it, you can help me get out of here. Trey is probably already dead, but there's still time! Please, can you help me?","0","0","0","0","0","0","0"
"6804","","You've already done me a great service, $n. For that I thank you.$B$BThe least I can do now is tell you what brought me here: My long time friend Trey Lightforge and I came to Jaedenar to investigate the Shadow Council when they caught us unprepared. They took Trey deeper into Shadow Hold and put me in here after taking all of our equipment... I can still hear his screams from below, $n. They were... inhuman. I don't know what they've done to him, but they will pay for it. ","0","0","0","0","0","0","0"
"6805","","As you inspect the cage and the Night elf inside, you get an odd sense of deja vu. For some reason she does not make eye contact with you--it is almost as if you are not there to her.","0","0","0","0","0","0","0"
"6817","Can't you see we're trying to prepare for Uther's visit? Now get out of my way, I have much work to do!","Can't you see we're trying to prepare for Uther's visit? Now get out of my way, I have much work to do!","0","1","5","0","0","0","0"
"6818","Have you tried our bread? Baker Masterson must be the most gifted chef to have ever lived!","Have you tried our bread? Baker Masterson must be the most gifted chef to have ever lived!","0","1","1","0","0","0","0"
"6819","Welcome to Caer Darrow, stranger.","Welcome to Caer Darrow, stranger.","0","2","0","0","0","0","0"
"6820","We're not really rude people, stranger, it's just that everyone is in a rush, trying to make sure that everything is perfect for Uther's arrival. It's not often that the Lightbringer comes to town.","We're not really rude people, stranger, it's just that everyone is in a rush, trying to make sure that everything is perfect for Uther's arrival. It's not often that the Lightbringer comes to town.","0","1","1","1","0","0","0"
"6821","Another lovely day on our beautiful island.","Another lovely day on our beautiful island.","0","1","0","0","0","0","0"
"6822","Watch your step, stranger. We do not allow miscreants in our town.","Watch your step, stranger. We do not allow miscreants in our town.","0","25","0","0","0","0","0"
"6823","I've got my eye on you, $r.","I've got my eye on you, $r.","0","25","0","0","0","0","0"
"6824","I have a lot of pent up anger and hostility. Just give me a reason, guttersnipe.","I have a lot of pent up anger and hostility. Just give me a reason, guttersnipe.","0","1","0","0","0","0","0"
"6825","Why, you look like a common street urchin!","Why, you look like a common street urchin!","0","5","0","0","0","0","0"
"6826","There's no loitering, pan handling, cursing, fighting, or anything else you're thinking about doing, allowed in Caer Darrow.","There's no loitering, pan handling, cursing, fighting, or anything else you're thinking about doing, allowed in Caer Darrow.","0","1","5","0","0","0","0"
"6843","The Cult of the Damned has grown large in scope. Nearly every city, from the capitals to the small hamlets and hovels of both the Horde and Alliance, have Cult members hidden amongst their citizenry.$B$BDo not look so surprised. The Cult only wears a uniform for ritual and ceremony. It is quite possible that you have interacted with one during your adventures and not even known.","","0","1","1","1","0","0","0"
"6845","Is it? This has always been their method of operation. What is of greater value to Kel'Thuzad and the ever growing Scourge army? A zealous, living, follower that can work their way into a society and then unleash a plague, destroying thousands; or a single undead trooper? Certainly you cannot be that dense$B$BYes, $r, they live, work, and plot among you.","","0","6","1","1","0","0","0"
"6847","Stop - no. Slow down - maybe.$B$BThe Scholomance is their primary source of training and education. It is from there that the Cult members fan out and ultimately, make their way into our societies.$B$BThat is why we must strike at the source. The very heart of the Cult of the Damned!","","0","1","1","5","0","0","0"
"6849","Slow down, $r. The one you need to kill is already dead. Killing him again will serve no purpose. There are very few ways in which a lich can actually be destroyed and none of those means are available to you or I. That is why I have a plan. A plan that will have a very noticeable and real impact upon the Cult.","","0","1","1","1","0","0","0"
"6851","It's simple, really. Rob the lich, Ras Frostwhisper, of his powers. Return him to his mortal form and then slay him, once and for all.","","0","1","0","0","0","0","0"
"6853","Ah, I suppose that I am getting ahead of myself. Ras Frostwhisper is the overseer of this school. The being responsible for training all of its Dark Masters. A lieutenant and favored pupil of Kel'Thuzad. He was once a hedge mage of Stromgarde: A rogue wizard that never received his formal training from Dalaran.$B$BWhen Kel'Thuzad opened the Cult, Ras was among the first to join his ranks. Ras knew that through dark magic, he would find immortality.","","0","1","1","1","0","0","0"
"6855","And find it he did. After quickly advancing through the ranks of the Cult, the Lich King himself granted Ras immortality. Thus was born Ras Frostwhisper, the lich.$B$BNow do you understand?","","0","1","1","6","0","0","0"
"6857","Good. In order to carry out my plan, we must first create a lifestone. Are you prepared to act?","","0","6","25","0","0","0","0"
"6859","Some were spared the anguish that memories provide.","","0","1","0","0","0","0","0"
"6863","The Barov house sure does keep me busy. Always some sort of refuse coming out of there.","","0","1","1","0","0","0","0"
"6864","My job title is Waste Management Specialist.","","0","1","0","0","0","0","0"
"6865","Perhaps you should speak into these sound enhancing devices attached to my FISTS OF FURY.","","0","14","0","0","0","0","0"
"6866","Ah, my sweet Brandy, I miss her so!","","0","1","0","0","0","0","0"
"6869","Well met, friend.  I am Officer Garush, and I am a proud member of a world-wide organization known as the Argent Dawn.  Our cause is to fight swiftly and mercilessly against any element of evil that surfaces in Azeroth.  We are not a political body, nor do we ever wish to become one.  Our cause is singular, and to that end we call both the Horde and Alliance as friends - friends in the cause of stamping out evil!$B$BFor the Dawn, my $g brother : sister;!","","0","66","0","0","0","0","0"
"6870","","Well met, friend.  I am Officer Pureheart, and I am a proud member of a world-wide organization known as the Argent Dawn.  Our cause is simple - fight swifty and mercilessly against any element of evil that surfaces in Azeroth.  We are not a political body, nor do we ever wish to become one.  To that end we call both the Alliance and the Horde both as friends - friends in the cause of stamping out evil!$B$BFor the Dawn, my $g brother : sister;!","0","66","0","0","0","0","0"
"6876","","The Argent Dawn salutes you, $c.  I am Hasana - one of but a few authorized equipment and materiel quartermasters for the Dawn.$B$BAs you fight evil under our commission - all the while earning our respect and trust - you'll earn valor tokens from Officer Garush.  Tokens serve two purposes: use them to gain increased standing within our ranks, or use them as tender in acquiring special items.$B$BAs you improve your standing with the Dawn, you'll discover that more items will be made available to you.","0","66","0","0","0","0","0"
"6877","","Join the fight against evil!  Accept a commission within the Argent Dawn today!","0","25","0","0","0","0","0"
"6879","The Argent Dawn salutes you, $c!  The name's Lightspark, and I'm an authorized equipment and materiel quartermaster for the Dawn.$B$BAs you fight evil under our commission - all the while earning our respect and trust - you'll earn valor tokens from Officer Pureheart.  Tokens serve two purposes: use them to gain increased standing within our ranks, or use them as tender in acquiring special items.$B$BAs you improve your standing with the Dawn, you'll discover that more items will be made available to you.","","0","66","0","0","0","0","0"
"6881","Join the fight against evil!  Accept a commission within the Argent Dawn today!","","0","25","0","0","0","0","0"
"6882","","Greetings, $c.  I am Miranda Breechlock - one of but a few authorized equipment and materiel quartermasters for the Dawn.$B$BAs you fight evil under our commission - all the while earning our respect and trust - you'll earn valor tokens from Duke Zverenhoff.  Tokens serve two purposes: use them to gain increased standing within our ranks, or use them as tender in acquiring special items.$B$BAs you improve your standing with the Dawn, you'll discover that more items will be made available to you.","0","2","0","0","0","0","0"
"6884","Greetings, $c.$B$BThose Sentinels over there have allowed me to share their camp as long as I promise no trouble will follow--I am sure you can appreciate the need for diplomacy while here, yes?$B$BI am here investigating disturbances to the land, and since it aids their cause also, they have agreed that my presence here could only aid the tenuous alliance between all of Azeroth's races. If you wish to aid me, then I would appreciate it, but regardless, please try not to cause any trouble.","","0","0","0","0","0","0","0"
"6888","Welcome to Steelgrill's Depot!","","0","2","0","0","0","0","0"
"6889","Race does not dictate honor, $r. While you remain on my farmstead, I ask that you remember and respect this credo.$B$BI have known orcs who have been as honorable as the most noble of knights and humans who have been as vile as the most ruthless of Scourge.$B$BBut I shall not bore you with tales of my youth! There is much work to be done - if that is what you desire. ","","0","1","1","254","0","0","0"
"6906","What are you looking for?","What are you looking for?","0","0","0","0","0","0","0"
"6913","A bank?  Well, the closest bank around here is The Stormwind Counting House.  It's just up the road in Stormwind not far from the gates.","A bank?  Well, the closest bank around here is The Stormwind Counting House.  It's just up the road in Stormwind not far from the gates.","0","0","0","0","0","0","0"
"6914","Oh, you must mean the Stormwind Counting House.  It's not far from the gates after you enter Stormwind.","Oh, you must mean the Stormwind Counting House.  It's not far from the gates after you enter Stormwind.","0","0","0","0","0","0","0"
"6921","There are quite a few trainers available in Elwynn.  Which one are you looking for?","There are quite a few trainers available in Elwynn.  Which one are you looking for?","0","0","0","0","0","0","0"
"6925","I've heard that there's a dwarf in Stormwind who has achieved some fame for his hunting skill.  Maybe you should go see if he could help you.","I've heard that there's a dwarf in Stormwind who has achieved some fame for his hunting skill.  Maybe you should go see if he could help you.","0","0","0","0","0","0","0"
"6927","Josetta has been a blessing to this town with her aid of the local guards.  If you seek her for training in the ways of a priest, you can find her in the Lion's Pride Inn.","Josetta has been a blessing to this town with her aid of the local guards.  If you seek her for training in the ways of a priest, you can find her in the Lion's Pride Inn.","0","0","0","0","0","0","0"
"6928","I bet Josetta would be more than happy to teach you some new spells.  She is probably up in her room at the Lion's Pride Inn.","I bet Josetta would be more than happy to teach you some new spells.  She is probably up in her room at the Lion's Pride Inn.","0","0","0","0","0","0","0"
"6936","A rogue?  Hmmm... well, I've heard that Keryn Sylvius hangs around those shady types.  You might want to talk to her and see what you can learn.","A rogue?  Hmmm... well, I've heard that Keryn Sylvius hangs around those shady types.  You might want to talk to her and see what you can learn.","0","0","0","0","0","0","0"
"6937","I'd wager Keryn Sylvius knows the type you're looking for. The company Keryn keeps is less than honorable. She usually hangs out in the Lion's Pride Inn.","I'd wager Keryn Sylvius knows the type you're looking for. The company Keryn keeps is less than honorable. She usually hangs out in the Lion's Pride Inn.","0","0","0","0","0","0","0"
"6944","I know of a few people around here that practice a profession or two.  What profession do you have in mind?","I know of a few people around here that practice a profession or two.  What profession do you have in mind?","0","0","0","0","0","0","0"
"6957","That hermit Mallory is known to concoct some potions for the local townsfolk on occasion.  He has a cottage in the hills between Stormwind and Northshire.","That hermit Mallory is known to concoct some potions for the local townsfolk on occasion.  He has a cottage in the hills between Stormwind and Northshire.","0","0","0","0","0","0","0"
"6958","There is an alchemist that lives up in the hills between Northshire and Stormwind that might be of some help.  Why don't you go pay him a visit?","There is an alchemist that lives up in the hills between Northshire and Stormwind that might be of some help.  Why don't you go pay him a visit?","0","0","0","0","0","0","0"
"6961","Tomas may not be the best cook around, but he has a few dishes that hit the spot.  He's currently working in the Lion's Pride Inn if you'd like to learn the profession.","Tomas may not be the best cook around, but he has a few dishes that hit the spot.  He's currently working in the Lion's Pride Inn if you'd like to learn the profession.","0","0","0","0","0","0","0"
"6962","Why don't you try looking in the Lion's Pride Inn?  The cook there might be able to teach you a few good recipes.","Why don't you try looking in the Lion's Pride Inn?  The cook there might be able to teach you a few good recipes.","0","0","0","0","0","0","0"
